userId,task,completed,title
2,21,False,suscipit repellat esse quibusdam voluptatem incidunt
2,22,True,distinctio vitae autem nihil ut molestias quo
2,23,False,et itaque necessitatibus maxime molestiae qui quas velit
2,24,False,adipisci non ad dicta qui amet quaerat doloribus ea
2,25,True,voluptas quo tenetur perspiciatis explicabo natus
2,26,True,aliquam aut quasi
2,27,True,veritatis pariatur delectus
2,28,False,nesciunt totam sit blanditiis sit
2,29,False,laborum aut in quam
2,30,True,nemo perspiciatis repellat ut dolor libero commodi blanditiis omnis
2,31,False,repudiandae totam in est sint facere fuga
2,32,False,earum doloribus ea doloremque quis
2,33,False,sint sit aut vero
2,34,False,porro aut necessitatibus eaque distinctio
2,35,True,repellendus veritatis molestias dicta incidunt
2,36,True,excepturi deleniti adipisci voluptatem et neque optio illum ad
2,37,False,sunt cum tempora
2,38,False,totam quia non
2,39,False,doloremque quibusdam asperiores libero corrupti illum qui omnis
2,40,True,totam atque quo nesciunt
